{
  "$schema": "https://json-schema.org/draft/2020-12/schema",
  "$id": "https://axius.example/schemas/codepet-proposal-input-v2.json",
  "title": "CodePet typed proposal input",
  "type": "object",
  "additionalProperties": false,
  "required": ["task", "operations", "tests"],
  "properties": {
    "task": {"type": "string", "minLength": 1, "maxLength": 20000},
    "rationale": {"type": "string", "maxLength": 20000, "default": ""},
    "risks": {
      "type": "array",
      "maxItems": 20,
      "items": {"type": "string", "maxLength": 1000},
      "default": []
    },
    "tests": {
      "type": "array",
      "minItems": 1,
      "uniqueItems": true,
      "items": {
        "enum": ["workspace-integrity", "python-compile", "python-unittest", "python-pytest", "npm-test"]
      }
    },
    "operations": {
      "type": "array",
      "minItems": 1,
      "maxItems": 50,
      "items": {
        "oneOf": [
          {
            "type": "object",
            "additionalProperties": false,
            "required": ["operation", "path", "content"],
            "properties": {
              "operation": {"const": "create"},
              "path": {"type": "string", "minLength": 1},
              "content": {"type": "string"}
            }
          },
          {
            "type": "object",
            "additionalProperties": false,
            "required": ["operation", "path", "content"],
            "properties": {
              "operation": {"const": "modify"},
              "path": {"type": "string", "minLength": 1},
              "content": {"type": "string"},
              "expected_sha256": {"type": "string", "pattern": "^[0-9a-f]{64}$"}
            }
          },
          {
            "type": "object",
            "additionalProperties": false,
            "required": ["operation", "path"],
            "properties": {
              "operation": {"const": "delete"},
              "path": {"type": "string", "minLength": 1},
              "expected_sha256": {"type": "string", "pattern": "^[0-9a-f]{64}$"}
            }
          }
        ]
      }
    }
  }
}
